"No.","Time","Source","Destination","Protocol","Length","Info"
"1","0.000000","37.130.194.56","192.168.0.105","TCP","54","443  >  55539 [ACK] Seq=1 Ack=1 Win=16391 Len=0"
"2","0.003956","192.168.0.105","37.130.194.56","SSL","143","Continuation Data"
"3","0.016085","192.168.0.105","37.130.194.56","SSL","1108","Continuation Data"
"4","0.018410","37.130.194.56","192.168.0.105","TCP","54","443  >  55539 [ACK] Seq=1 Ack=1213 Win=16391 Len=0"
"5","0.021984","192.168.0.105","37.130.194.56","SSL","1109","Continuation Data"
"6","0.028012","192.168.0.105","37.130.194.56","SSL","139","Continuation Data"
"7","0.039131","37.130.194.56","192.168.0.105","TCP","54","443  >  55539 [ACK] Seq=1 Ack=3322 Win=16391 Len=0"
"8","0.045910","192.168.0.105","37.130.194.56","SSL","139","Continuation Data"
"9","0.051895","192.168.0.105","37.130.194.56","SSL","1135","Continuation Data"
"10","0.057848","192.168.0.105","37.130.194.56","SSL","1135","Continuation Data"
"11","0.063975","192.168.0.105","37.130.194.56","SSL","136","Continuation Data"
"12","0.064963","37.130.194.56","192.168.0.105","TCP","54","443  >  55539 [ACK] Seq=1 Ack=3492 Win=16391 Len=0"
"13","0.073935","37.130.194.56","192.168.0.105","TCP","54","443  >  55539 [ACK] Seq=1 Ack=5654 Win=16391 Len=0"
"14","0.087769","192.168.0.105","37.130.194.56","SSL","134","Continuation Data"
"15","0.088028","192.168.0.105","37.130.194.56","SSL","1158","Continuation Data"
"16","0.093754","192.168.0.105","37.130.194.56","SSL","1159","Continuation Data"
"17","0.102214","37.130.194.56","192.168.0.105","TCP","54","443  >  55539 [ACK] Seq=1 Ack=5816 Win=16391 Len=0"
"18","0.105721","192.168.0.105","37.130.194.56","SSL","129","Continuation Data"
"19","0.106096","192.168.0.105","37.130.194.56","SSL","1221","Continuation Data"
"20","0.108332","37.130.194.56","192.168.0.105","TCP","54","443  >  55539 [ACK] Seq=1 Ack=8025 Win=16391 Len=0"
"21","0.111618","192.168.0.105","37.130.194.56","SSL","1222","Continuation Data"
"22","0.123075","37.130.194.56","192.168.0.105","TCP","54","443  >  55539 [ACK] Seq=1 Ack=9267 Win=16391 Len=0"
"23","0.123631","192.168.0.105","37.130.194.56","SSL","133","Continuation Data"
"24","0.138030","37.130.194.56","192.168.0.105","TCP","54","443  >  55539 [ACK] Seq=1 Ack=10514 Win=16391 Len=0"
"25","0.141582","192.168.0.105","37.130.194.56","SSL","1166","Continuation Data"
"26","0.147683","192.168.0.105","37.130.194.56","SSL","130","Continuation Data"
"27","0.148096","192.168.0.105","37.130.194.56","SSL","1166","Continuation Data"
"28","0.161992","37.130.194.56","192.168.0.105","TCP","54","443  >  55539 [ACK] Seq=1 Ack=11702 Win=16391 Len=0"
"29","0.165657","192.168.0.105","37.130.194.56","SSL","130","Continuation Data"
"30","0.177558","192.168.0.105","37.130.194.56","SSL","1115","Continuation Data"
"31","0.181369","37.130.194.56","192.168.0.105","TCP","54","443  >  55539 [ACK] Seq=1 Ack=12890 Win=16391 Len=0"
"32","0.183561","192.168.0.105","37.130.194.56","SSL","133","Continuation Data"
"33","0.183952","192.168.0.105","37.130.194.56","SSL","1116","Continuation Data"
"34","0.197733","37.130.194.56","192.168.0.105","TCP","54","443  >  55539 [ACK] Seq=1 Ack=14030 Win=16391 Len=0"
"35","0.207425","192.168.0.105","37.130.194.56","SSL","135","Continuation Data"
"36","0.207718","192.168.0.105","37.130.194.56","SSL","1188","Continuation Data"
"37","0.213356","192.168.0.105","37.130.194.56","SSL","1188","Continuation Data"
"38","0.221533","37.130.194.56","192.168.0.105","TCP","54","443  >  55539 [ACK] Seq=1 Ack=15173 Win=16391 Len=0"
"39","0.225571","192.168.0.105","37.130.194.56","SSL","131","Continuation Data"
"40","0.227965","37.130.194.56","192.168.0.105","TCP","54","443  >  55539 [ACK] Seq=1 Ack=17441 Win=16391 Len=0"
"41","0.243359","192.168.0.105","37.130.194.56","SSL","1219","Continuation Data"
"42","0.249276","192.168.0.105","37.130.194.56","SSL","127","Continuation Data"
"43","0.249458","192.168.0.105","37.130.194.56","SSL","1220","Continuation Data"
"44","0.258632","37.130.194.56","192.168.0.105","TCP","54","443  >  55539 [ACK] Seq=1 Ack=18683 Win=16391 Len=0"
"45","0.258757","192.168.0.105","37.130.194.64","TLSv1.2","163","Application Data"
"46","0.264948","37.130.194.56","192.168.0.105","TCP","54","443  >  55539 [ACK] Seq=1 Ack=19922 Win=16391 Len=0"
"47","0.267407","192.168.0.105","37.130.194.56","SSL","126","Continuation Data"
"48","0.272707","37.130.194.64","192.168.0.105","TCP","54","443  >  55511 [ACK] Seq=1 Ack=110 Win=189 Len=0"
"49","0.272976","37.130.194.64","192.168.0.105","TLSv1.2","159","Application Data"
"50","0.285347","192.168.0.105","37.130.194.56","SSL","123","Continuation Data"
"51","0.291324","192.168.0.105","37.130.194.56","SSL","1137","Continuation Data"
"52","0.297213","192.168.0.105","37.130.194.56","SSL","1138","Continuation Data"
"53","0.301113","37.130.194.56","192.168.0.105","TCP","54","443  >  55539 [ACK] Seq=1 Ack=20063 Win=16391 Len=0"
"54","0.303179","192.168.0.105","37.130.194.56","SSL","127","Continuation Data"
"55","0.311532","37.130.194.56","192.168.0.105","TCP","54","443  >  55539 [ACK] Seq=1 Ack=22230 Win=16391 Len=0"
"56","0.315969","192.168.0.105","37.130.194.64","TCP","54","55511  >  443 [ACK] Seq=110 Ack=106 Win=516 Len=0"
"57","0.321123","192.168.0.105","37.130.194.56","SSL","1216","Continuation Data"
"58","0.327080","192.168.0.105","37.130.194.56","SSL","126","Continuation Data"
"59","0.327274","192.168.0.105","37.130.194.56","SSL","1216","Continuation Data"
"60","0.335105","37.130.194.56","192.168.0.105","TCP","54","443  >  55539 [ACK] Seq=1 Ack=23465 Win=16391 Len=0"
"61","0.342788","37.130.194.56","192.168.0.105","TCP","54","443  >  55539 [ACK] Seq=1 Ack=24699 Win=16391 Len=0"
"62","0.345010","192.168.0.105","37.130.194.56","SSL","128","Continuation Data"
"63","0.345257","192.168.0.105","37.130.194.56","SSL","1110","Continuation Data"
"64","0.350937","192.168.0.105","37.130.194.56","SSL","1110","Continuation Data"
"65","0.359499","37.130.194.56","192.168.0.105","TCP","54","443  >  55539 [ACK] Seq=1 Ack=25829 Win=16391 Len=0"
"66","0.362989","192.168.0.105","37.130.194.56","SSL","131","Continuation Data"
"67","0.377476","37.130.194.56","192.168.0.105","TCP","54","443  >  55539 [ACK] Seq=1 Ack=26962 Win=16391 Len=0"
"68","0.380927","192.168.0.105","37.130.194.56","SSL","1089","Continuation Data"
"69","0.387078","192.168.0.105","37.130.194.56","SSL","130","Continuation Data"
"70","0.387338","192.168.0.105","37.130.194.56","SSL","1090","Continuation Data"
"71","0.401112","37.130.194.56","192.168.0.105","TCP","54","443  >  55539 [ACK] Seq=1 Ack=28073 Win=16391 Len=0"
"72","0.405049","192.168.0.105","37.130.194.56","SSL","127","Continuation Data"
"73","0.420886","37.130.194.56","192.168.0.105","TCP","54","443  >  55539 [ACK] Seq=1 Ack=29182 Win=16391 Len=0"
"74","0.422902","192.168.0.105","37.130.194.56","SSL","128","Continuation Data"
"75","0.423345","192.168.0.105","37.130.194.56","SSL","1109","Continuation Data"
"76","0.428821","192.168.0.105","37.130.194.56","SSL","1110","Continuation Data"
"77","0.437550","37.130.194.56","192.168.0.105","TCP","54","443  >  55539 [ACK] Seq=1 Ack=30311 Win=16391 Len=0"
"78","0.440843","192.168.0.105","37.130.194.56","SSL","1100","Continuation Data"
"79","0.446913","192.168.0.105","37.130.194.56","SSL","124","Continuation Data"
"80","0.447191","192.168.0.105","37.130.194.56","SSL","1101","Continuation Data"
"81","0.461225","37.130.194.56","192.168.0.105","TCP","54","443  >  55539 [ACK] Seq=1 Ack=32413 Win=16391 Len=0"
"82","0.461399","37.130.194.56","192.168.0.105","TCP","54","443  >  55539 [ACK] Seq=1 Ack=33530 Win=16391 Len=0"
"83","0.464914","192.168.0.105","37.130.194.56","SSL","128","Continuation Data"
"84","0.482763","192.168.0.105","37.130.194.56","SSL","130","Continuation Data"
"85","0.483064","192.168.0.105","37.130.194.56","SSL","1152","Continuation Data"
"86","0.488660","192.168.0.105","37.130.194.56","SSL","1152","Continuation Data"
"87","0.497130","37.130.194.56","192.168.0.105","TCP","54","443  >  55539 [ACK] Seq=1 Ack=33680 Win=16391 Len=0"
"88","0.502712","37.130.194.56","192.168.0.105","TCP","54","443  >  55539 [ACK] Seq=1 Ack=35876 Win=16391 Len=0"
"89","0.506873","192.168.0.105","37.130.194.56","SSL","130","Continuation Data"
"90","0.509713","192.168.0.105","37.130.194.56","SSL","168","Continuation Data"
"91","0.518592","192.168.0.105","37.130.194.56","SSL","1166","Continuation Data"
"92","0.524710","192.168.0.105","37.130.194.56","SSL","127","Continuation Data"
"93","0.525021","37.130.194.56","192.168.0.105","TCP","54","443  >  55539 [ACK] Seq=1 Ack=36066 Win=16391 Len=0"
"94","0.525077","192.168.0.105","37.130.194.56","SSL","1167","Continuation Data"
"95","0.525217","37.130.194.56","192.168.0.105","SSL","120","Continuation Data"
"96","0.525221","37.130.194.56","192.168.0.105","SSL","156","Continuation Data"
"97","0.525310","192.168.0.105","37.130.194.56","TCP","54","55539  >  443 [ACK] Seq=38364 Ack=169 Win=515 Len=0"
"98","0.525915","192.168.0.105","37.130.194.56","SSL","120","Continuation Data"
"99","0.538756","37.130.194.56","192.168.0.105","TCP","54","443  >  55539 [ACK] Seq=169 Ack=37251 Win=16391 Len=0"
"100","0.542042","37.130.194.56","192.168.0.105","TCP","54","443  >  55539 [ACK] Seq=169 Ack=38430 Win=16391 Len=0"
"101","0.542546","192.168.0.105","37.130.194.56","SSL","123","Continuation Data"
"102","0.548439","192.168.0.105","37.130.194.56","SSL","1225","Continuation Data"
"103","0.554606","192.168.0.105","37.130.194.56","SSL","1225","Continuation Data"
"104","0.566575","192.168.0.105","37.130.194.56","SSL","125","Continuation Data"
"105","0.567693","37.130.194.56","192.168.0.105","TCP","54","443  >  55539 [ACK] Seq=169 Ack=39670 Win=16391 Len=0"
"106","0.578417","192.168.0.105","37.130.194.56","SSL","1175","Continuation Data"
"107","0.580267","37.130.194.56","192.168.0.105","TCP","54","443  >  55539 [ACK] Seq=169 Ack=40912 Win=16391 Len=0"
"108","0.584470","192.168.0.105","37.130.194.56","SSL","126","Continuation Data"
"109","0.584746","192.168.0.105","37.130.194.56","SSL","1176","Continuation Data"
"110","0.598667","37.130.194.56","192.168.0.105","TCP","54","443  >  55539 [ACK] Seq=169 Ack=42105 Win=16391 Len=0"
"111","0.607416","192.168.0.105","37.130.194.56","SSL","123","Continuation Data"
"112","0.607852","192.168.0.105","37.130.194.56","SSL","1119","Continuation Data"
"113","0.613470","192.168.0.105","37.130.194.56","SSL","1120","Continuation Data"
"114","0.621697","37.130.194.56","192.168.0.105","TCP","54","443  >  55539 [ACK] Seq=169 Ack=43296 Win=16391 Len=0"
"115","0.625433","192.168.0.105","37.130.194.56","SSL","125","Continuation Data"
"116","0.628842","37.130.194.56","192.168.0.105","TCP","54","443  >  55539 [ACK] Seq=169 Ack=45427 Win=16391 Len=0"
"117","0.642828","192.168.0.105","37.130.194.56","SSL","127","Continuation Data"
"118","0.642973","192.168.0.105","37.130.194.56","SSL","1113","Continuation Data"
"119","0.648745","192.168.0.105","37.130.194.56","SSL","1114","Continuation Data"
"120","0.659396","37.130.194.56","192.168.0.105","TCP","54","443  >  55539 [ACK] Seq=169 Ack=45571 Win=16391 Len=0"
"121","0.662986","37.130.194.56","192.168.0.105","TCP","54","443  >  55539 [ACK] Seq=169 Ack=47690 Win=16391 Len=0"
"122","0.665757","192.168.0.105","37.130.194.56","SSL","125","Continuation Data"
"123","0.666145","192.168.0.105","37.130.194.56","SSL","1217","Continuation Data"
"124","0.671717","192.168.0.105","37.130.194.56","SSL","1218","Continuation Data"
"125","0.675709","192.168.0.105","37.130.194.56","SSL","126","Continuation Data"
"126","0.680173","37.130.194.56","192.168.0.105","TCP","54","443  >  55539 [ACK] Seq=169 Ack=48924 Win=16391 Len=0"
"127","0.683803","192.168.0.105","37.130.194.56","SSL","122","Continuation Data"
"128","0.689506","37.130.194.56","192.168.0.105","TCP","54","443  >  55539 [ACK] Seq=169 Ack=50160 Win=16391 Len=0"
"129","0.699771","192.168.0.105","37.130.194.56","SSL","78","Continuation Data"
"130","0.707742","192.168.0.105","37.130.194.56","SSL","132","Continuation Data"
"131","0.714264","37.130.194.56","192.168.0.105","TCP","54","443  >  55539 [ACK] Seq=169 Ack=50252 Win=16391 Len=0"
"132","0.725773","192.168.0.105","37.130.194.56","SSL","134","Continuation Data"
"133","0.726320","192.168.0.105","37.130.194.56","SSL","1001","Continuation Data"
"134","0.726584","192.168.0.105","37.130.194.56","SSL","1002","Continuation Data"
"135","0.743319","192.168.0.105","37.130.194.56","SSL","131","Continuation Data"
"136","0.743628","37.130.194.56","192.168.0.105","TCP","54","443  >  55539 [ACK] Seq=169 Ack=50410 Win=16391 Len=0"
"137","0.743723","37.130.194.56","192.168.0.105","TCP","54","443  >  55539 [ACK] Seq=169 Ack=52305 Win=16391 Len=0"
"138","0.755011","192.168.0.105","37.130.194.56","SSL","1182","Continuation Data"
"139","0.760969","192.168.0.105","37.130.194.56","SSL","1182","Continuation Data"
"140","0.767058","192.168.0.105","37.130.194.56","SSL","131","Continuation Data"
"141","0.769299","37.130.194.56","192.168.0.105","TCP","54","443  >  55539 [ACK] Seq=169 Ack=53510 Win=16391 Len=0"
"142","0.778971","192.168.0.105","37.130.194.56","SSL","1230","Continuation Data"
"143","0.781273","37.130.194.56","192.168.0.105","TCP","54","443  >  55539 [ACK] Seq=169 Ack=54715 Win=16391 Len=0"
"144","0.784886","192.168.0.105","37.130.194.56","SSL","131","Continuation Data"
"145","0.785201","192.168.0.105","37.130.194.56","SSL","1230","Continuation Data"
"146","0.799029","37.130.194.56","192.168.0.105","TCP","54","443  >  55539 [ACK] Seq=169 Ack=55968 Win=16391 Len=0"
"147","0.802868","192.168.0.105","37.130.194.56","SSL","129","Continuation Data"
"148","0.815049","192.168.0.105","37.130.194.56","SSL","1245","Continuation Data"
"149","0.818493","37.130.194.56","192.168.0.105","TCP","54","443  >  55539 [ACK] Seq=169 Ack=57219 Win=16391 Len=0"
"150","0.820977","192.168.0.105","37.130.194.56","SSL","1245","Continuation Data"
"151","0.826936","192.168.0.105","37.130.194.56","SSL","127","Continuation Data"
"152","0.835430","37.130.194.56","192.168.0.105","TCP","54","443  >  55539 [ACK] Seq=169 Ack=59601 Win=16391 Len=0"
"153","0.845061","192.168.0.105","37.130.194.56","SSL","127","Continuation Data"
"154","0.856918","192.168.0.105","37.130.194.56","SSL","1196","Continuation Data"
"155","0.859982","37.130.194.56","192.168.0.105","TCP","54","443  >  55539 [ACK] Seq=169 Ack=59747 Win=16391 Len=0"
"156","0.862719","192.168.0.105","37.130.194.56","SSL","128","Continuation Data"
"157","0.862960","192.168.0.105","37.130.194.56","SSL","1196","Continuation Data"
"158","0.877023","37.130.194.56","192.168.0.105","TCP","54","443  >  55539 [ACK] Seq=169 Ack=60963 Win=16391 Len=0"
"159","0.880688","192.168.0.105","37.130.194.56","SSL","1151","Continuation Data"
"160","0.886652","192.168.0.105","37.130.194.56","SSL","139","Continuation Data"
"161","0.886844","192.168.0.105","37.130.194.56","SSL","1152","Continuation Data"
"162","0.895610","37.130.194.56","192.168.0.105","TCP","54","443  >  55539 [ACK] Seq=169 Ack=63202 Win=16391 Len=0"
"163","0.901536","37.130.194.56","192.168.0.105","TCP","54","443  >  55539 [ACK] Seq=169 Ack=64385 Win=16391 Len=0"
"164","0.904694","192.168.0.105","37.130.194.56","SSL","145","Continuation Data"
"165","0.916722","192.168.0.105","37.130.194.56","SSL","1052","Continuation Data"
"166","0.922592","192.168.0.105","37.130.194.56","SSL","148","Continuation Data"
"167","0.922872","192.168.0.105","37.130.194.56","SSL","1053","Continuation Data"
"168","0.932165","37.130.194.56","192.168.0.105","TCP","54","443  >  55539 [ACK] Seq=169 Ack=65474 Win=16391 Len=0"
"169","0.936916","37.130.194.56","192.168.0.105","TCP","54","443  >  55539 [ACK] Seq=169 Ack=66567 Win=16391 Len=0"
"170","0.940001","192.168.0.105","37.130.194.56","SSL","1007","Continuation Data"
"171","0.945991","192.168.0.105","37.130.194.56","SSL","142","Continuation Data"
"172","0.946271","192.168.0.105","37.130.194.56","SSL","1007","Continuation Data"
"173","0.960113","37.130.194.56","192.168.0.105","TCP","54","443  >  55539 [ACK] Seq=169 Ack=67608 Win=16391 Len=0"
"174","0.964097","192.168.0.105","37.130.194.56","SSL","143","Continuation Data"
"175","0.976007","192.168.0.105","37.130.194.56","SSL","911","Continuation Data"
"176","0.976257","192.168.0.105","37.130.194.56","SSL","911","Continuation Data"
"177","0.987954","192.168.0.105","37.130.194.56","SSL","141","Continuation Data"
"178","0.988336","37.130.194.56","192.168.0.105","TCP","54","443  >  55539 [ACK] Seq=169 Ack=68650 Win=16391 Len=0"
"179","0.991535","37.130.194.56","192.168.0.105","TCP","54","443  >  55539 [ACK] Seq=169 Ack=70364 Win=16391 Len=0"
"180","1.005900","192.168.0.105","37.130.194.56","SSL","136","Continuation Data"
"181","1.006291","192.168.0.105","37.130.194.56","SSL","1243","Continuation Data"
"182","1.011820","192.168.0.105","37.130.194.56","SSL","1243","Continuation Data"
"183","1.020383","37.130.194.56","192.168.0.105","TCP","54","443  >  55539 [ACK] Seq=169 Ack=70533 Win=16391 Len=0"
"184","1.023921","192.168.0.105","37.130.194.56","SSL","142","Continuation Data"
"185","1.027716","37.130.194.56","192.168.0.105","TCP","54","443  >  55539 [ACK] Seq=169 Ack=72911 Win=16391 Len=0"
"186","1.041803","192.168.0.105","37.130.194.56","SSL","880","Continuation Data"
"187","1.042206","192.168.0.105","37.130.194.56","SSL","880","Continuation Data"
"188","1.047885","192.168.0.105","37.130.194.56","SSL","141","Continuation Data"
"189","1.048323","192.168.0.105","37.130.194.56","SSL","881","Continuation Data"
"190","1.057275","37.130.194.56","192.168.0.105","TCP","54","443  >  55539 [ACK] Seq=169 Ack=73825 Win=16391 Len=0"
"191","1.062141","37.130.194.56","192.168.0.105","TCP","54","443  >  55539 [ACK] Seq=169 Ack=74738 Win=16391 Len=0"
"192","1.065870","192.168.0.105","37.130.194.56","SSL","143","Continuation Data"
"193","1.077777","192.168.0.105","37.130.194.56","SSL","1153","Continuation Data"
"194","1.080464","37.130.194.56","192.168.0.105","TCP","54","443  >  55539 [ACK] Seq=169 Ack=75654 Win=16391 Len=0"
"195","1.083739","192.168.0.105","37.130.194.56","SSL","146","Continuation Data"
"196","1.084133","192.168.0.105","37.130.194.56","SSL","1153","Continuation Data"
"197","1.098085","37.130.194.56","192.168.0.105","TCP","54","443  >  55539 [ACK] Seq=169 Ack=76845 Win=16391 Len=0"
"198","1.107132","192.168.0.105","37.130.194.56","SSL","153","Continuation Data"
"199","1.107585","192.168.0.105","37.130.194.56","SSL","1115","Continuation Data"
"200","1.113092","192.168.0.105","37.130.194.56","SSL","1115","Continuation Data"
"201","1.124982","37.130.194.56","192.168.0.105","TCP","54","443  >  55539 [ACK] Seq=169 Ack=78043 Win=16391 Len=0"
"202","1.125039","192.168.0.105","37.130.194.56","SSL","151","Continuation Data"
"203","1.127407","37.130.194.56","192.168.0.105","TCP","54","443  >  55539 [ACK] Seq=169 Ack=80165 Win=16391 Len=0"
"204","1.142941","192.168.0.105","37.130.194.56","SSL","147","Continuation Data"
"205","1.143277","192.168.0.105","37.130.194.56","SSL","1053","Continuation Data"
"206","1.149006","192.168.0.105","37.130.194.56","SSL","1054","Continuation Data"
"207","1.159070","37.130.194.56","192.168.0.105","TCP","54","443  >  55539 [ACK] Seq=169 Ack=80355 Win=16391 Len=0"
"208","1.164810","37.130.194.56","192.168.0.105","TCP","54","443  >  55539 [ACK] Seq=169 Ack=82354 Win=16391 Len=0"
"209","1.167129","192.168.0.105","37.130.194.56","SSL","143","Continuation Data"
"210","1.184937","192.168.0.105","37.130.194.56","SSL","140","Continuation Data"
"211","1.190900","192.168.0.105","37.130.194.56","SSL","1086","Continuation Data"
"212","1.196843","192.168.0.105","37.130.194.56","SSL","1087","Continuation Data"
"213","1.199228","37.130.194.56","192.168.0.105","TCP","54","443  >  55539 [ACK] Seq=169 Ack=82529 Win=16391 Len=0"
"214","1.202772","192.168.0.105","37.130.194.56","SSL","136","Continuation Data"
"215","1.208874","192.168.0.105","37.130.194.56","SSL","1098","Continuation Data"
"216","1.211039","37.130.194.56","192.168.0.105","TCP","54","443  >  55539 [ACK] Seq=169 Ack=84594 Win=16391 Len=0"
"217","1.215000","192.168.0.105","37.130.194.56","SSL","1099","Continuation Data"
"218","1.226290","37.130.194.56","192.168.0.105","TCP","54","443  >  55539 [ACK] Seq=169 Ack=85720 Win=16391 Len=0"
"219","1.226882","192.168.0.105","37.130.194.56","SSL","134","Continuation Data"
"220","1.242272","37.130.194.56","192.168.0.105","TCP","54","443  >  55539 [ACK] Seq=169 Ack=86845 Win=16391 Len=0"
"221","1.246132","192.168.0.105","37.130.194.56","SSL","132","Continuation Data"
"222","1.251695","192.168.0.105","37.130.194.56","SSL","1056","Continuation Data"
"223","1.257786","192.168.0.105","37.130.194.56","SSL","1056","Continuation Data"
"224","1.263794","192.168.0.105","37.130.194.56","SSL","132","Continuation Data"
"225","1.272389","37.130.194.56","192.168.0.105","TCP","54","443  >  55539 [ACK] Seq=169 Ack=87925 Win=16391 Len=0"
"226","1.274810","192.168.0.105","37.130.194.64","TLSv1.2","162","Application Data"
"227","1.278158","37.130.194.56","192.168.0.105","TCP","54","443  >  55539 [ACK] Seq=169 Ack=89005 Win=16391 Len=0"
"228","1.281625","192.168.0.105","37.130.194.56","SSL","1183","Continuation Data"
"229","1.287693","192.168.0.105","37.130.194.56","SSL","140","Continuation Data"
"230","1.288078","192.168.0.105","37.130.194.56","SSL","1184","Continuation Data"
"231","1.289828","37.130.194.64","192.168.0.105","TLSv1.2","158","Application Data"
"232","1.290800","192.168.0.105","37.130.194.64","TLSv1.2","229","Application Data"
"233","1.304754","37.130.194.56","192.168.0.105","TCP","54","443  >  55539 [ACK] Seq=169 Ack=90220 Win=16391 Len=0"
"234","1.305816","192.168.0.105","37.130.194.56","SSL","142","Continuation Data"
"235","1.311579","192.168.0.105","37.130.194.56","SSL","1162","Continuation Data"
"236","1.317599","192.168.0.105","37.130.194.56","SSL","1162","Continuation Data"
"237","1.323627","192.168.0.105","37.130.194.56","SSL","144","Continuation Data"
"238","1.347759","192.168.0.105","37.130.194.56","SSL","138","Continuation Data"
"239","1.348016","37.130.194.64","192.168.0.105","TCP","54","443  >  55511 [ACK] Seq=210 Ack=393 Win=195 Len=0"
"240","1.351599","37.130.194.56","192.168.0.105","TCP","54","443  >  55539 [ACK] Seq=169 Ack=91350 Win=16391 Len=0"
"241","1.353489","192.168.0.105","37.130.194.56","SSL","871","Continuation Data"
"242","1.353812","192.168.0.105","37.130.194.56","SSL","872","Continuation Data"
"243","1.359398","192.168.0.105","37.130.194.56","SSL","872","Continuation Data"
"244","1.365390","192.168.0.105","37.130.194.56","SSL","131","Continuation Data"
"245","1.383500","192.168.0.105","37.130.194.56","SSL","131","Continuation Data"
"246","1.395175","192.168.0.105","37.130.194.56","TCP","1494","[TCP Retransmission] 55539  >  443 [PSH, ACK] Seq=94995 Ack=169 Win=515 Len=1440"
"247","1.407301","192.168.0.105","37.130.194.56","SSL","134","Continuation Data"
"248","1.407670","192.168.0.105","37.130.194.56","SSL","1221","Continuation Data"
"249","1.413437","192.168.0.105","37.130.194.56","SSL","1221","Continuation Data"
"250","1.425386","192.168.0.105","37.130.194.56","SSL","131","Continuation Data"
"251","1.443256","192.168.0.105","37.130.194.56","SSL","135","Continuation Data"
"252","1.443634","192.168.0.105","37.130.194.56","SSL","1080","Continuation Data"
"253","1.449145","192.168.0.105","37.130.194.56","SSL","1080","Continuation Data"
"254","1.467174","192.168.0.105","37.130.194.56","SSL","135","Continuation Data"
"255","1.467589","192.168.0.105","37.130.194.56","SSL","1089","Continuation Data"
"256","1.473060","192.168.0.105","37.130.194.56","SSL","1090","Continuation Data"
"257","1.485096","192.168.0.105","37.130.194.56","SSL","131","Continuation Data"
"258","1.497049","192.168.0.105","37.130.194.56","SSL","1064","Continuation Data"
"259","1.503021","192.168.0.105","37.130.194.56","SSL","134","Continuation Data"
"260","1.503212","192.168.0.105","37.130.194.56","SSL","1065","Continuation Data"
"261","1.526948","192.168.0.105","37.130.194.56","SSL","132","Continuation Data"
"262","1.532965","192.168.0.105","37.130.194.56","SSL","912","Continuation Data"
"263","1.533259","192.168.0.105","37.130.194.56","SSL","913","Continuation Data"
"264","1.544871","192.168.0.105","37.130.194.56","SSL","159","Continuation Data"
"265","1.562889","192.168.0.105","37.130.194.56","SSL","159","Continuation Data"
"266","1.565832","192.168.0.105","37.130.194.56","SSL","78","Continuation Data"
"267","1.580835","192.168.0.105","37.130.194.56","SSL","1113","Continuation Data"
"268","1.586960","192.168.0.105","37.130.194.56","SSL","157","Continuation Data"
"269","1.587306","192.168.0.105","37.130.194.56","SSL","1114","Continuation Data"
"270","1.604916","192.168.0.105","37.130.194.56","SSL","172","Continuation Data"
"271","1.621863","192.168.0.105","37.130.194.56","SSL","1161","Continuation Data"
"272","1.627741","192.168.0.105","37.130.194.56","SSL","156","Continuation Data"
"273","1.627985","192.168.0.105","37.130.194.56","SSL","1162","Continuation Data"
"274","1.643329","192.168.0.105","37.130.194.56","SSL","126","Continuation Data"
"275","1.645641","192.168.0.105","37.130.194.56","SSL","161","Continuation Data"
"276","1.645738","192.168.0.105","37.130.194.56","SSL","1144","Continuation Data"
"277","1.651651","192.168.0.105","37.130.194.56","SSL","1145","Continuation Data"
"278","1.663757","192.168.0.105","37.130.194.56","SSL","164","Continuation Data"
"279","1.687592","192.168.0.105","37.130.194.56","SSL","153","Continuation Data"
"280","1.688000","192.168.0.105","37.130.194.56","SSL","1115","Continuation Data"
"281","1.693504","192.168.0.105","37.130.194.56","SSL","1115","Continuation Data"
"282","1.695362","192.168.0.105","37.130.194.56","TCP","1494","[TCP Out-Of-Order] 55539  >  443 [PSH, ACK] Seq=91350 Ack=169 Win=515 Len=1440"
"283","1.812510","37.130.194.56","192.168.0.105","TCP","54","443  >  55539 [ACK] Seq=169 Ack=91438 Win=16391 Len=0"
"284","1.812610","37.130.194.56","192.168.0.105","TCP","54","443  >  55539 [ACK] Seq=169 Ack=92546 Win=16391 Len=0"
"285","1.812612","37.130.194.56","192.168.0.105","TCP","54","443  >  55539 [ACK] Seq=169 Ack=93654 Win=16391 Len=0"
"286","1.812614","37.130.194.56","192.168.0.105","TCP","54","443  >  55539 [ACK] Seq=169 Ack=93744 Win=16391 Len=0"
"287","1.812656","192.168.0.105","37.130.194.56","TCP","1494","[TCP Retransmission] 55539  >  443 [PSH, ACK] Seq=93744 Ack=169 Win=515 Len=1440"
"288","1.812659","192.168.0.105","37.130.194.56","TCP","1494","[TCP Retransmission] 55539  >  443 [PSH, ACK] Seq=95184 Ack=169 Win=515 Len=1440"
"289","1.814719","37.130.194.56","192.168.0.105","TCP","54","443  >  55539 [ACK] Seq=169 Ack=93828 Win=16391 Len=0"
"290","1.814764","192.168.0.105","37.130.194.56","TCP","1176","[TCP Retransmission] 55539  >  443 [PSH, ACK] Seq=96624 Ack=169 Win=515 Len=1122"
"291","1.815078","37.130.194.56","192.168.0.105","TCP","54","443  >  55539 [ACK] Seq=169 Ack=94645 Win=16391 Len=0"
"292","1.815082","37.130.194.56","192.168.0.105","TCP","54","443  >  55539 [ACK] Seq=169 Ack=95463 Win=16391 Len=0"
"293","1.815084","37.130.194.56","192.168.0.105","TCP","54","443  >  55539 [ACK] Seq=169 Ack=96281 Win=16391 Len=0"
"294","1.815087","37.130.194.56","192.168.0.105","TCP","54","443  >  55539 [ACK] Seq=169 Ack=96358 Win=16391 Len=0"
"295","1.815090","37.130.194.56","192.168.0.105","TCP","54","443  >  55539 [ACK] Seq=169 Ack=96435 Win=16391 Len=0"
"296","1.815145","192.168.0.105","37.130.194.56","TCP","1494","[TCP Retransmission] 55539  >  443 [PSH, ACK] Seq=97746 Ack=169 Win=515 Len=1440"
"297","1.815149","192.168.0.105","37.130.194.56","TCP","1494","[TCP Retransmission] 55539  >  443 [PSH, ACK] Seq=99186 Ack=169 Win=515 Len=1440"
"298","1.815151","192.168.0.105","37.130.194.56","TCP","1494","[TCP Retransmission] 55539  >  443 [PSH, ACK] Seq=100626 Ack=169 Win=515 Len=1440"
"299","1.815156","192.168.0.105","37.130.194.56","TCP","948","[TCP Retransmission] 55539  >  443 [PSH, ACK] Seq=102066 Ack=169 Win=515 Len=894"
"300","1.815420","37.130.194.56","192.168.0.105","TCP","66","[TCP Dup ACK 295#1] 443  >  55539 [ACK] Seq=169 Ack=96435 Win=16391 Len=0 SLE=94995 SRE=96435"
"301","1.815424","37.130.194.56","192.168.0.105","TCP","54","443  >  55539 [ACK] Seq=169 Ack=96515 Win=16391 Len=0"
"302","1.815426","37.130.194.56","192.168.0.105","TCP","54","443  >  55539 [ACK] Seq=169 Ack=97682 Win=16391 Len=0"
"303","1.815428","37.130.194.56","192.168.0.105","TCP","54","443  >  55539 [ACK] Seq=169 Ack=98849 Win=16391 Len=0"
"304","1.815431","37.130.194.56","192.168.0.105","TCP","54","443  >  55539 [ACK] Seq=169 Ack=98926 Win=16391 Len=0"
"305","1.815444","37.130.194.56","192.168.0.105","TCP","54","443  >  55539 [ACK] Seq=169 Ack=99007 Win=16391 Len=0"
"306","1.815448","37.130.194.56","192.168.0.105","TCP","54","443  >  55539 [ACK] Seq=169 Ack=100033 Win=16391 Len=0"
"307","1.815516","192.168.0.105","37.130.194.56","TCP","1494","[TCP Retransmission] 55539  >  443 [PSH, ACK] Seq=102960 Ack=169 Win=515 Len=1440"
"308","1.815520","192.168.0.105","37.130.194.56","TCP","1494","[TCP Retransmission] 55539  >  443 [PSH, ACK] Seq=104400 Ack=169 Win=515 Len=1440"
"309","1.815522","192.168.0.105","37.130.194.56","TCP","1494","[TCP Retransmission] 55539  >  443 [PSH, ACK] Seq=105840 Ack=169 Win=515 Len=1440"
"310","1.815536","192.168.0.105","37.130.194.56","TCP","1494","[TCP Retransmission] 55539  >  443 [PSH, ACK] Seq=107280 Ack=169 Win=515 Len=1440"
"311","1.815542","192.168.0.105","37.130.194.56","TCP","1490","[TCP Retransmission] 55539  >  443 [PSH, ACK] Seq=108720 Ack=169 Win=515 Len=1436"
"312","1.815766","37.130.194.56","192.168.0.105","TCP","54","443  >  55539 [ACK] Seq=169 Ack=101059 Win=16391 Len=0"
"313","1.815770","37.130.194.56","192.168.0.105","TCP","54","443  >  55539 [ACK] Seq=169 Ack=101140 Win=16391 Len=0"
"314","1.815772","37.130.194.56","192.168.0.105","TCP","54","443  >  55539 [ACK] Seq=169 Ack=102175 Win=16391 Len=0"
"315","1.815820","192.168.0.105","37.130.194.56","TCP","1494","[TCP Retransmission] 55539  >  443 [PSH, ACK] Seq=110156 Ack=169 Win=515 Len=1440"
"316","1.815824","192.168.0.105","37.130.194.56","TCP","1494","[TCP Retransmission] 55539  >  443 [PSH, ACK] Seq=111596 Ack=169 Win=515 Len=1440"
"317","1.815827","192.168.0.105","37.130.194.56","TCP","1458","[TCP Retransmission] 55539  >  443 [PSH, ACK] Seq=113036 Ack=169 Win=515 Len=1404"
"318","1.815957","37.130.194.56","192.168.0.105","TCP","54","443  >  55539 [ACK] Seq=169 Ack=103211 Win=16391 Len=0"
"319","1.815962","37.130.194.56","192.168.0.105","TCP","54","443  >  55539 [ACK] Seq=169 Ack=103288 Win=16391 Len=0"
"320","1.815964","37.130.194.56","192.168.0.105","TCP","54","443  >  55539 [ACK] Seq=169 Ack=104298 Win=16391 Len=0"
"321","1.815966","37.130.194.56","192.168.0.105","TCP","54","443  >  55539 [ACK] Seq=169 Ack=104378 Win=16391 Len=0"
"322","1.815969","37.130.194.56","192.168.0.105","TCP","54","443  >  55539 [ACK] Seq=169 Ack=105389 Win=16391 Len=0"
"323","1.816069","192.168.0.105","37.130.194.56","TCP","1494","[TCP Retransmission] 55539  >  443 [PSH, ACK] Seq=114440 Ack=169 Win=515 Len=1440"
"324","1.816074","192.168.0.105","37.130.194.56","TCP","1494","[TCP Retransmission] 55539  >  443 [PSH, ACK] Seq=115880 Ack=169 Win=515 Len=1440"
"325","1.816076","192.168.0.105","37.130.194.56","SSL","1494","Continuation Data"
"326","1.816079","192.168.0.105","37.130.194.56","SSL","1494","Continuation Data"
"327","1.816083","192.168.0.105","37.130.194.56","SSL","722","Continuation Data"
"328","1.816300","37.130.194.56","192.168.0.105","TCP","54","443  >  55539 [ACK] Seq=169 Ack=105467 Win=16391 Len=0"
"329","1.816303","37.130.194.56","192.168.0.105","TCP","54","443  >  55539 [ACK] Seq=169 Ack=107184 Win=16391 Len=0"
"330","1.816305","37.130.194.56","192.168.0.105","TCP","54","443  >  55539 [ACK] Seq=169 Ack=108477 Win=16391 Len=0"
"331","1.816307","37.130.194.56","192.168.0.105","TCP","54","443  >  55539 [ACK] Seq=169 Ack=109640 Win=16391 Len=0"
"332","1.816310","37.130.194.56","192.168.0.105","TCP","54","443  >  55539 [ACK] Seq=169 Ack=110865 Win=16391 Len=0"
"333","1.816314","37.130.194.56","192.168.0.105","TCP","54","443  >  55539 [ACK] Seq=169 Ack=112075 Win=16391 Len=0"
"334","1.816316","37.130.194.56","192.168.0.105","TCP","54","443  >  55539 [ACK] Seq=169 Ack=113344 Win=16391 Len=0"
"335","1.816319","37.130.194.56","192.168.0.105","TCP","54","443  >  55539 [ACK] Seq=169 Ack=114545 Win=16391 Len=0"
"336","1.816396","192.168.0.105","37.130.194.56","SSL","1494","Continuation Data"
"337","1.816399","192.168.0.105","37.130.194.56","SSL","1494","Continuation Data"
"338","1.816402","192.168.0.105","37.130.194.56","SSL","1494","Continuation Data"
"339","1.816406","192.168.0.105","37.130.194.56","SSL","789","Continuation Data"
"340","1.816721","37.130.194.56","192.168.0.105","TCP","54","443  >  55539 [ACK] Seq=169 Ack=115705 Win=16391 Len=0"
"341","1.825874","192.168.0.105","37.130.194.56","SSL","160","Continuation Data"
"342","1.826621","37.130.194.56","192.168.0.105","TCP","66","443  >  55539 [ACK] Seq=169 Ack=116766 Win=16391 Len=0 SLE=93744 SRE=95184"
"343","1.826945","37.130.194.56","192.168.0.105","TCP","66","[TCP Dup ACK 342#1] 443  >  55539 [ACK] Seq=169 Ack=116766 Win=16391 Len=0 SLE=95184 SRE=96624"
"344","1.828730","37.130.194.56","192.168.0.105","TCP","66","[TCP Dup ACK 342#2] 443  >  55539 [ACK] Seq=169 Ack=116766 Win=16391 Len=0 SLE=96624 SRE=97746"
"345","1.829025","37.130.194.56","192.168.0.105","TCP","66","[TCP Dup ACK 342#3] 443  >  55539 [ACK] Seq=169 Ack=116766 Win=16391 Len=0 SLE=97746 SRE=99186"
"346","1.829067","192.168.0.105","37.130.194.56","SSL","1494","[TCP Fast Retransmission] , Continuation Data"
"347","1.829288","37.130.194.56","192.168.0.105","TCP","66","[TCP Dup ACK 342#4] 443  >  55539 [ACK] Seq=169 Ack=116766 Win=16391 Len=0 SLE=99186 SRE=100626"
"348","1.829684","37.130.194.56","192.168.0.105","TCP","66","[TCP Dup ACK 342#5] 443  >  55539 [ACK] Seq=169 Ack=116766 Win=16391 Len=0 SLE=100626 SRE=102066"
"349","1.829688","37.130.194.56","192.168.0.105","TCP","66","[TCP Dup ACK 342#6] 443  >  55539 [ACK] Seq=169 Ack=116766 Win=16391 Len=0 SLE=102066 SRE=102960"
"350","1.829690","37.130.194.56","192.168.0.105","TCP","66","[TCP Dup ACK 342#7] 443  >  55539 [ACK] Seq=169 Ack=116766 Win=16391 Len=0 SLE=102960 SRE=104400"
"351","1.829691","37.130.194.56","192.168.0.105","TCP","66","[TCP Dup ACK 342#8] 443  >  55539 [ACK] Seq=169 Ack=116766 Win=16391 Len=0 SLE=104400 SRE=105840"
"352","1.830010","37.130.194.56","192.168.0.105","TCP","66","[TCP Dup ACK 342#9] 443  >  55539 [ACK] Seq=169 Ack=116766 Win=16391 Len=0 SLE=105840 SRE=107280"
"353","1.830014","37.130.194.56","192.168.0.105","TCP","66","[TCP Dup ACK 342#10] 443  >  55539 [ACK] Seq=169 Ack=116766 Win=16391 Len=0 SLE=107280 SRE=108720"
"354","1.830015","37.130.194.56","192.168.0.105","TCP","66","[TCP Dup ACK 342#11] 443  >  55539 [ACK] Seq=169 Ack=116766 Win=16391 Len=0 SLE=108720 SRE=110156"
"355","1.830938","37.130.194.56","192.168.0.105","TCP","66","[TCP Dup ACK 342#12] 443  >  55539 [ACK] Seq=169 Ack=116766 Win=16391 Len=0 SLE=110156 SRE=111596"
"356","1.831325","37.130.194.56","192.168.0.105","TCP","66","[TCP Dup ACK 342#13] 443  >  55539 [ACK] Seq=169 Ack=116766 Win=16391 Len=0 SLE=111596 SRE=113036"
"357","1.831329","37.130.194.56","192.168.0.105","TCP","66","[TCP Dup ACK 342#14] 443  >  55539 [ACK] Seq=169 Ack=116766 Win=16391 Len=0 SLE=113036 SRE=114440"
"358","1.831677","37.130.194.56","192.168.0.105","TCP","66","[TCP Dup ACK 342#15] 443  >  55539 [ACK] Seq=169 Ack=116766 Win=16391 Len=0 SLE=114440 SRE=115880"
"359","1.831681","37.130.194.56","192.168.0.105","TCP","66","443  >  55539 [ACK] Seq=169 Ack=117320 Win=16391 Len=0 SLE=115880 SRE=116766"
"360","1.831683","37.130.194.56","192.168.0.105","TCP","54","443  >  55539 [ACK] Seq=169 Ack=118760 Win=16391 Len=0"
"361","1.831893","37.130.194.56","192.168.0.105","TCP","54","443  >  55539 [ACK] Seq=169 Ack=120200 Win=16391 Len=0"
"362","1.831896","37.130.194.56","192.168.0.105","TCP","54","443  >  55539 [ACK] Seq=169 Ack=120868 Win=16391 Len=0"
"363","1.832206","37.130.194.56","192.168.0.105","TCP","54","443  >  55539 [ACK] Seq=169 Ack=122308 Win=16391 Len=0"
"364","1.832209","37.130.194.56","192.168.0.105","TCP","54","443  >  55539 [ACK] Seq=169 Ack=123748 Win=16391 Len=0"
"365","1.832211","37.130.194.56","192.168.0.105","TCP","54","443  >  55539 [ACK] Seq=169 Ack=125188 Win=16391 Len=0"
"366","1.832212","37.130.194.56","192.168.0.105","TCP","54","443  >  55539 [ACK] Seq=169 Ack=125923 Win=16391 Len=0"
"367","1.839979","37.130.194.56","192.168.0.105","TCP","54","443  >  55539 [ACK] Seq=169 Ack=126029 Win=16391 Len=0"
"368","1.843776","192.168.0.105","37.130.194.56","SSL","165","Continuation Data"
"369","1.844238","192.168.0.105","37.130.194.56","SSL","1248","Continuation Data"
"370","1.849631","192.168.0.105","37.130.194.56","SSL","1249","Continuation Data"
"371","1.849892","37.130.194.56","192.168.0.105","TCP","66","[TCP Dup ACK 367#1] 443  >  55539 [ACK] Seq=169 Ack=126029 Win=16391 Len=0 SLE=116766 SRE=118206"
"372","1.858766","37.130.194.56","192.168.0.105","TCP","54","443  >  55539 [ACK] Seq=169 Ack=126140 Win=16391 Len=0"
"373","1.863241","37.130.194.56","192.168.0.105","TCP","54","443  >  55539 [ACK] Seq=169 Ack=127334 Win=16391 Len=0"
"374","1.866236","37.130.194.56","192.168.0.105","TCP","54","443  >  55539 [ACK] Seq=169 Ack=128529 Win=16391 Len=0"
"375","1.867676","192.168.0.105","37.130.194.56","SSL","165","Continuation Data"
"376","1.879598","192.168.0.105","37.130.194.56","SSL","1234","Continuation Data"
"377","1.881886","37.130.194.56","192.168.0.105","TCP","54","443  >  55539 [ACK] Seq=169 Ack=128640 Win=16391 Len=0"
"378","1.885521","192.168.0.105","37.130.194.56","SSL","161","Continuation Data"
"379","1.885824","192.168.0.105","37.130.194.56","SSL","1234","Continuation Data"
"380","1.898035","37.130.194.56","192.168.0.105","TCP","54","443  >  55539 [ACK] Seq=169 Ack=129820 Win=16391 Len=0"
"381","1.899766","37.130.194.56","192.168.0.105","TCP","54","443  >  55539 [ACK] Seq=169 Ack=129927 Win=16391 Len=0"
"382","1.903007","192.168.0.105","37.130.194.56","SSL","152","Continuation Data"
"383","1.903384","192.168.0.105","37.130.194.56","SSL","1114","Continuation Data"
"384","1.904284","37.130.194.56","192.168.0.105","TCP","54","443  >  55539 [ACK] Seq=169 Ack=131107 Win=16391 Len=0"
"385","1.908939","192.168.0.105","37.130.194.56","SSL","1114","Continuation Data"
"386","1.917953","37.130.194.56","192.168.0.105","TCP","54","443  >  55539 [ACK] Seq=169 Ack=131205 Win=16391 Len=0"
"387","1.918067","37.130.194.56","192.168.0.105","TCP","54","443  >  55539 [ACK] Seq=169 Ack=132265 Win=16391 Len=0"
"388","1.923204","37.130.194.56","192.168.0.105","TCP","54","443  >  55539 [ACK] Seq=169 Ack=133325 Win=16391 Len=0"
"389","1.926977","192.168.0.105","37.130.194.56","SSL","155","Continuation Data"
"390","1.927357","192.168.0.105","37.130.194.56","SSL","1144","Continuation Data"
"391","1.932918","192.168.0.105","37.130.194.56","SSL","1145","Continuation Data"
"392","1.941243","37.130.194.56","192.168.0.105","TCP","54","443  >  55539 [ACK] Seq=169 Ack=133426 Win=16391 Len=0"
"393","1.941470","37.130.194.56","192.168.0.105","TCP","54","443  >  55539 [ACK] Seq=169 Ack=134516 Win=16391 Len=0"
"394","1.944806","192.168.0.105","37.130.194.56","SSL","159","Continuation Data"
"395","1.947122","37.130.194.56","192.168.0.105","TCP","54","443  >  55539 [ACK] Seq=169 Ack=135607 Win=16391 Len=0"
"396","1.959619","37.130.194.56","192.168.0.105","TCP","54","443  >  55539 [ACK] Seq=169 Ack=135712 Win=16391 Len=0"
"397","1.969023","192.168.0.105","37.130.194.56","SSL","151","Continuation Data"
"398","1.983368","37.130.194.56","192.168.0.105","TCP","54","443  >  55539 [ACK] Seq=169 Ack=135809 Win=16391 Len=0"
"399","1.986859","192.168.0.105","37.130.194.56","SSL","154","Continuation Data"
"400","1.992820","192.168.0.105","37.130.194.56","SSL","1107","Continuation Data"
"401","1.998726","192.168.0.105","37.130.194.56","SSL","1108","Continuation Data"
